{
  "title": "Blueprint: Dashboards Ejecutivos RCM desde SQLite hasta React — HF Multi-Clínica",
  "domain": "executive-reports",
  "date": "2026-05",
  "status": "verified",
  "tags": [
    "rcm",
    "revenue-cycle",
    "denial-management",
    "claims-analytics",
    "sqlite",
    "react-dashboard",
    "recharts",
    "multi-clinic",
    "timely-filing",
    "cpt-analysis",
    "hispano-medical",
    "dfw",
    "billing-transition",
    "category-ii-cpt",
    "capitation",
    "835-remittance",
    "monday-com",
    "executive-report"
  ],
  "summary": "Pipeline completo SQLite→React para análisis ejecutivo de RCM en grupo médico multi-clínica (12 ubicaciones DFW): 45K+ claims, métricas verificadas, 12 lecciones de errores críticos de datos.",
  "related": [
    "rcm-operations/denial-tracker-monday-board/",
    "rcm-operations/cpt-gap-analysis/",
    "billing-config/dual-architecture-ikon-ecw/"
  ],
  "author": "Seidel Delgado"
}
